{
  "schema_version": "1.0.0",
  "checklist_id": "checklist.skill_release_gate",
  "title_zh": "Skill 发布门禁",
  "title_en": "Skill Release Gate",
  "items": [
    {"id": "release.static_validation", "question_zh": "结构、schema、链接和节点长度检查是否通过？", "question_en": "Did structure, schema, links, and node-budget checks pass?", "required": true},
    {"id": "release.regression", "question_zh": "最近失败样例和核心回归套件是否通过？", "question_en": "Did recent failure cases and the core regression suite pass?", "required": true},
    {"id": "release.paired_eval", "question_zh": "是否完成 with/without 或 old/new 配对评估？", "question_en": "Was with/without or old/new paired evaluation completed?", "required": true},
    {"id": "release.activation", "question_zh": "触发准确率和误触发率是否达到阈值？", "question_en": "Did activation precision and false-trigger rate meet thresholds?", "required": true},
    {"id": "release.cost", "question_zh": "上下文、token、工具调用和运行时间是否在预算内？", "question_en": "Are context, token, tool-call, and runtime costs within budget?", "required": true},
    {"id": "release.controls", "question_zh": "权限、路径、网络和人工确认边界是否验证？", "question_en": "Were permission, path, network, and human-gate boundaries verified?", "required": true},
    {"id": "release.rollback", "question_zh": "是否有回滚、下线或禁用策略？", "question_en": "Is there a rollback, deprecation, or disable strategy?", "required": true},
    {"id": "release.version_manifest", "question_zh": "是否存在发布清单，记录版本、变更类型、兼容性、测试证据和回滚入口？", "question_en": "Is there a release manifest recording version, change type, compatibility, test evidence, and rollback entrypoint?", "required": true},
    {"id": "release.observability", "question_zh": "运行时是否能记录 skill_id、skill_version、trace_id、tool_calls、loaded_doc_ids 和指标？", "question_en": "Can runtime logs capture skill_id, skill_version, trace_id, tool_calls, loaded_doc_ids, and metrics?", "required": true},
    {"id": "release.deprecation", "question_zh": "破坏性变更是否提供弃用元数据、替代 skill 和迁移窗口？", "question_en": "Do breaking changes provide deprecation metadata, replacement skill, and migration window?", "required": true}
  ]
}
