{
  "schema_version": "1.0.0",
  "checklist_id": "checklist.skill_release",
  "title_zh": "Skill 发布检查清单",
  "title_en": "Skill Release Checklist",
  "items": [
    {"id": "release.design_record", "required": true, "check_zh": "存在 skill_design_record，且触发、边界、协议、资源和风险完整。", "check_en": "A skill design record exists and covers trigger, boundaries, protocol, resources, and risk."},
    {"id": "release.node_budget", "required": true, "check_zh": "入口和图谱节点保持短文本，长内容通过 id/path 外链。", "check_en": "Entrypoints and graph nodes stay short; long content is linked by id/path."},
    {"id": "release.eval_cases", "required": true, "check_zh": "至少有正例、反例、边界例和邻近误触发例。", "check_en": "Includes happy, negative, boundary, and adjacent false-trigger cases."},
    {"id": "release.deterministic_grader", "required": true, "check_zh": "至少一个验收信号是确定性检查。", "check_en": "At least one acceptance signal is deterministic."},
    {"id": "release.trajectory", "required": true, "check_zh": "关键流程有轨迹断言或 trace 证据。", "check_en": "Critical workflows have trajectory assertions or trace evidence."},
    {"id": "release.paired_eval", "required": true, "check_zh": "存在 with-skill / without-skill 或 old/new 配对评估。", "check_en": "A paired with-skill / without-skill or old/new evaluation exists."},
    {"id": "release.metrics", "required": true, "check_zh": "记录成功率、触发准确率、稳定性、成本、上下文长度和控制指标。", "check_en": "Records success, activation, reliability, cost, context length, and control metrics."},
    {"id": "release.regression", "required": true, "check_zh": "失败样例已进入回归套件。", "check_en": "Failure cases are added to the regression suite."}
  ]
}
