{
  "schema_version": "1.0.0",
  "checklist_id": "checklist.skill_design_review",
  "title_zh": "Skill 设计审查清单",
  "title_en": "Skill Design Review Checklist",
  "items": [
    {"id": "design.scope", "question_zh": "是否定义了目标任务、非目标任务和邻近误触发任务？", "question_en": "Are target, non-target, and adjacent false-trigger tasks defined?", "required": true},
    {"id": "design.trigger", "question_zh": "触发条件是否可测试，而不是只有抽象描述？", "question_en": "Are trigger rules testable rather than only abstract?", "required": true},
    {"id": "design.protocol", "question_zh": "执行协议是否包含预检、步骤、验证、失败路径和汇报？", "question_en": "Does the execution protocol include preflight, steps, verification, failure paths, and reporting?", "required": true},
    {"id": "design.resources", "question_zh": "长内容是否从入口移出，并通过路径或 id 按需加载？", "question_en": "Is long content moved out of the entrypoint and loaded by path or id?", "required": true},
    {"id": "design.controls", "question_zh": "危险动作是否有权限边界或人工确认条件？", "question_en": "Do risky actions have permission boundaries or human gate conditions?", "required": true},
    {"id": "design.tests", "question_zh": "是否至少有正例、反例、边界例测试资产？", "question_en": "Are there at least positive, negative, and boundary test assets?", "required": true},
    {"id": "design.metrics", "question_zh": "是否定义成功、触发、成本和稳定性指标？", "question_en": "Are success, activation, cost, and stability metrics defined?", "required": true}
  ]
}

