{
  "schema_version": "1.0.0",
  "checklist_id": "checklist.security_boundary",
  "title_zh": "Skill 控制边界检查清单",
  "title_en": "Skill Control Boundary Checklist",
  "items": [
    {"id": "boundary.permissions", "required": true, "check_zh": "明确 allowed_tools、forbidden_tools、allowed_paths 和网络边界。", "check_en": "Defines allowed tools, forbidden tools, allowed paths, and network boundaries."},
    {"id": "boundary.human_gate", "required": true, "check_zh": "高风险、不可逆、付费、凭证、生产写入动作需要人工确认条件。", "check_en": "Human gate conditions exist for high-risk, irreversible, paid, credential, or production-write actions."},
    {"id": "boundary.output_schema", "required": true, "check_zh": "关键输出存在 schema、格式或文件路径契约。", "check_en": "Critical outputs have schema, format, or file-path contracts."},
    {"id": "boundary.fail_closed", "required": true, "check_zh": "权限不足、输入缺失、工具失败时默认停止或降级，不绕过边界。", "check_en": "Missing permissions, missing inputs, or tool failures fail closed or degrade without bypassing boundaries."},
    {"id": "boundary.supply_chain", "required": false, "check_zh": "脚本、依赖、模板来源可追溯并可版本化。", "check_en": "Scripts, dependencies, and templates have provenance and versioning."}
  ],
  "reference_ids": ["ref.openai.practical_agents", "ref.owasp.agentic_skills_top10", "ref.owasp.llm_top10", "ref.mcp.security"]
}
